datasetSpeciesName,acceptedName,namingAuthority
Juniperus communis,Juniperus communis L.,Adams 2018
Dicranum dispersum,Dicranum dispersum Engelm.,Afonina and Breen 2009
Thelypteris quelpaertensis,Oreopteris quelpaertensis (Christ) Holub,Almeida et al. 2016
Caloplaca holocarpa,"Athallia holocarpa (Hoffm.) Arup, Frödén & Søchting",Arup et al. 2013
Caloplaca ammiospila,"Blastenia ammiospila (Wahlenb.) Arup, Søchting & Frödén",Arup et al. 2013
Caloplaca jungermanniae,"Bryoplaca jungermanniae (Vahl) Søchting, Frödén & Arup",Arup et al. 2013
Caloplaca tetraspora,"Bryoplaca tetraspora (Nyl.) Søchting, Frödén & Arup",Arup et al. 2013
Caloplaca species,Caloplaca Th. Fr.,Arup et al. 2013
Fulgensia bracteata,Gyalolechia bracteata (Hoffm.) A. Massal.,Arup et al. 2013
Caloplaca xanthostigmoidea,"Gyalolechia xanthostigmoidea (Räsänen) Søchting, Frödén & Arup",Arup et al. 2013
Caloplaca tiroliensis,"Parvoplaca tiroliensis (Zahlbr.) Arup, Søchting & Frödén",Arup et al. 2013
Xanthoria candelaria,"Polycauliona candelaria (L.) Frödén, Arup, & Søchting",Arup et al. 2013
Xanthoria elegans,Rusavskia elegans (Link) S.Y. Kondr. & Kärnefelt,Arup et al. 2013
Galearis rotundifolia,Galearis rotundifolia (Banks ex Pursh) R.M. Bateman,Bateman et al. 2009
Limnorchis aquilonis,Platanthera aquilonis Sheviak,Bateman et al. 2009
Limnorchis hyperborea,Platanthera aquilonis Sheviak,Bateman et al. 2009
Platanthera hyperborea,Platanthera aquilonis Sheviak,Bateman et al. 2009
Platanthera chorisiana,Platanthera chorisiana (Cham.) Rchb.,Bateman et al. 2009
Limnorchis dilatata,Platanthera dilatata (Pursh) Lindl. ex Beck,Bateman et al. 2009
Lysiella obtusata,Platanthera obtusata (Banks ex Pursh) Lindl.,Bateman et al. 2009
Platanthera obtusata,Platanthera obtusata (Banks ex Pursh) Lindl.,Bateman et al. 2009
Limnorchis species,Platanthera Rich.,Bateman et al. 2009
Piperia unalascensis,Platanthera unalascensis (Spreng.) Kurtz,Bateman et al. 2009
Melanohalea septentrionalis,"Melanohalea septentrionalis (Lynge) O. Blanco, A. Crespo, Divakar, Essl., D. Hawksw. & Lumbsch",Blanco et al. 2004
Hypnum vaucheri,"Buckia vaucheri (Lesq.) D. Ríos, M.T. Gallego & J. Guerra",Câmara et al. 2018
Hypnum procerrimum,Pseudostereodon procerrimus (Molendo) M. Fleisch.,Câmara et al. 2018
Hypnum revolutum,Roaldia revoluta (Mitt.) P.E.A.S. Câmara & M. Carvalho-Silva,Câmara et al. 2018
Askellia nana,Askellia pygmaea (Ledeb.) Sennikov,Chambers and Meyers 2011
Campylium zemliae,Campylium zemliae (C.E.O. Jensen) C.E.O. Jensen,Consortium of Bryophyte Herbaria
Campylium calcareum,Campylophyllopsis calcarea (Crundw. & Nyholm) Ochyra,Consortium of Bryophyte Herbaria
Frullania tamarisci,Frullania tamarisci (L.) Dumort.,Consortium of Bryophyte Herbaria
Cephalozia loitlesbergeri,Fuscocephaloziopsis loitlesbergeri (Schiffn.) Vána & L. Söderstr.,Consortium of Bryophyte Herbaria
Jungermannia polaris,Jungermannia polaris Lindb.,Consortium of Bryophyte Herbaria
Macrodiplophyllum species,Macrodiplophyllum (H. Buch) Perss.,Consortium of Bryophyte Herbaria
Marchantia polymorpha s. ruderalis,Marchantia polymorpha ssp. ruderalis Bischl. & Boissel.-Dub.,Consortium of Bryophyte Herbaria
Mnium ambiguum,Mnium lycopodioides Schwägr.,Consortium of Bryophyte Herbaria
!Oncophorus demetrii,Oncophorus demetrii (Renauld & Cardot) Hedenäs,Consortium of Bryophyte Herbaria
Pseudoleskeella catenulata,Pseudoleskeella catenulata (Brid. ex Schrad.) Kindb.,Consortium of Bryophyte Herbaria
Schistidium andreaeopsis,Schistidium andreaeopsis (Müll. Hal.) Laz.,Consortium of Bryophyte Herbaria
Sphagnum divinum,Sphagnum divinum Flatberg & K. Hassel,Consortium of Bryophyte Herbaria
Acarospora schleicheri,Acarospora schleicheri (Ach.) A. Massal.,Consortium of Lichen Herbaria
Agonimia gelatinosa,Agonimia gelatinosa (Ach.) Brand & Diederich,Consortium of Lichen Herbaria
Agonimia tristicula,Agonimia tristicula (Nyl.) Zahlbr.,Consortium of Lichen Herbaria
Alectoria ochroleuca,Alectoria ochroleuca (Hoffm.) A. Massal.,Consortium of Lichen Herbaria
Alectoria sarmentosa s. vexillifera,Alectoria vexillifera (Nyl.) Stizenb.,Consortium of Lichen Herbaria
Allantoparmelia almquistii,Allantoparmelia almquistii (Vain.) Essl.,Consortium of Lichen Herbaria
Allocetraria madreporiformis,Allocetraria madreporiformis (Ach.) Kärnefelt & Thell,Consortium of Lichen Herbaria
Amandinea punctata,Amandinea punctata (Hoffm.) Coppins & Scheid.,Consortium of Lichen Herbaria
Anaptychia bryorum,Anaptychia bryorum Poelt,Consortium of Lichen Herbaria
Arctocetraria andrejevii,Arctocetraria andrejevii (Oksner) Kärnefelt & A. Thell,Consortium of Lichen Herbaria
Arctocetraria nigricascens,Arctocetraria nigricascens (Nyl.) Kärnefelt & A. Thell,Consortium of Lichen Herbaria
Arctomia delicatula,Arctomia delicatula Th. Fr.,Consortium of Lichen Herbaria
Arctoparmelia centrifuga,Arctoparmelia centrifuga (L.) Hale,Consortium of Lichen Herbaria
Arctoparmelia species,Arctoparmelia Hale,Consortium of Lichen Herbaria
Arctoparmelia incurva,Arctoparmelia incurva (Pers.) Hale,Consortium of Lichen Herbaria
Arctoparmelia separata,Arctoparmelia separata (Th. Fr.) Hale,Consortium of Lichen Herbaria
Arthrorhaphis alpina,Arthrorhaphis alpina (Schaer.) R. Sant.,Consortium of Lichen Herbaria
Arthrorhaphis species,Arthrorhaphis Th. Fr.,Consortium of Lichen Herbaria
Asahinea chrysantha,Asahinea chrysantha (Tuck.) W.L. Culb. & C.F. Culb.,Consortium of Lichen Herbaria
Asahinea scholanderi,Asahinea scholanderi (Llano) W.L. Culb. & C.F. Culb.,Consortium of Lichen Herbaria
Asahinea species,Asahinea W.L. Culb. & C.F. Culb.,Consortium of Lichen Herbaria
Bacidia bagliettoana,Bacidia bagliettoana (A. Massal. & De Not.) Jatta,Consortium of Lichen Herbaria
Baeomyces carneus,Baeomyces carneus Flörke,Consortium of Lichen Herbaria
Baeomyces species,Baeomyces Pers.,Consortium of Lichen Herbaria
Baeomyces placophyllus,Baeomyces placophyllus Ach.,Consortium of Lichen Herbaria
Baeomyces rufus,Baeomyces rufus (Huds.) Rebent.,Consortium of Lichen Herbaria
Biatora subduplex,Biatora subduplex (Nyl.) Printzen,Consortium of Lichen Herbaria
Biatora vernalis,Biatora vernalis (L.) Fr.,Consortium of Lichen Herbaria
Biatorella species,Biatorella De Not.,Consortium of Lichen Herbaria
Bilimbia lobulata,Bilimbia lobulata (Sommerf.) Hafellner & Coppins,Consortium of Lichen Herbaria
Brodoa oroarctica,Brodoa oroarctica (Krog) Goward,Consortium of Lichen Herbaria
Bryocaulon divergens,Bryocaulon divergens (Ach.) Kärnefelt,Consortium of Lichen Herbaria
Bryocaulon species,Bryocaulon Kärnefelt,Consortium of Lichen Herbaria
Bryocaulon sp.,Bryocaulon Kärnefelt,Consortium of Lichen Herbaria
Bryocaulon,Bryocaulon Kärnefelt,Consortium of Lichen Herbaria
Bryonora castanea,Bryonora castanea (Hepp) Poelt,Consortium of Lichen Herbaria
Bryoria species,Bryoria Brodo & D. Hawksw.,Consortium of Lichen Herbaria
Bryoria sp.,Bryoria Brodo & D. Hawksw.,Consortium of Lichen Herbaria
Bryoria,Bryoria Brodo & D. Hawksw.,Consortium of Lichen Herbaria
Bryoria nitidula,Bryoria nitidula (Th. Fr.) Brodo & D. Hawksw.,Consortium of Lichen Herbaria
Bryoria trichodes,Bryoria trichodes (Michx.) Brodo & D. Hawksw.,Consortium of Lichen Herbaria
Caloplaca cerina,Caloplaca cerina (Ehrh. ex Hedw.) Th. Fr.,Consortium of Lichen Herbaria
Caloplaca fraudans,Caloplaca fraudans (Th. Fr.) H. Olivier,Consortium of Lichen Herbaria
Caloplaca phaeocarpella,Caloplaca phaeocarpella (Nyl.) Zahlbr.,Consortium of Lichen Herbaria
Candelariella species,Candelariella Müll. Arg.,Consortium of Lichen Herbaria
Candelariella placodizans,Candelariella placodizans (Nyl.) H. Magn.,Consortium of Lichen Herbaria
Candelariella terrigena,Candelariella terrigena Räsänen,Consortium of Lichen Herbaria
Catapyrenium cinereum,Catapyrenium cinereum (Pers.) Körb.,Consortium of Lichen Herbaria
Catapyrenium species,Catapyrenium Flot.,Consortium of Lichen Herbaria
Cetraria species,Cetraria Ach.,Consortium of Lichen Herbaria
Cetraria sp.,Cetraria Ach.,Consortium of Lichen Herbaria
Cetraria,Cetraria Ach.,Consortium of Lichen Herbaria
Cetraria aculeata,Cetraria aculeata (Schreb.) Fr.,Consortium of Lichen Herbaria
Cetraria ericetorum,Cetraria ericetorum Opiz,Consortium of Lichen Herbaria
Cetraria islandica,Cetraria islandica (L.) Ach.,Consortium of Lichen Herbaria
Cetraria cf. islandica,Cetraria islandica (L.) Ach.,Consortium of Lichen Herbaria
Cetraria islandica ssp. islandica,Cetraria islandica ssp. islandica (L.) Ach.,Consortium of Lichen Herbaria
Cetraria kamczatica,Cetraria kamczatica Savicz,Consortium of Lichen Herbaria
Cetraria laevigata,Cetraria laevigata Rass.,Consortium of Lichen Herbaria
Cetraria muricata,Cetraria muricata (Ach.) Eckfeldt,Consortium of Lichen Herbaria
Cetraria nigricans,Cetraria nigricans Nyl.,Consortium of Lichen Herbaria
Melanelia commixta,Cetrariella commixta (Nyl.) A. Thell & Kärnefelt,Consortium of Lichen Herbaria
Cetrariella delisei,Cetrariella delisei (Bory ex Schaer.) Kärnefelt & Thell,Consortium of Lichen Herbaria
Cetraria fastigiata,Cetrariella fastigiata (Delise ex Nyl.) Kärnefelt & A. Thell,Consortium of Lichen Herbaria
Cetrariella fastigiata,Cetrariella fastigiata (Delise ex Nyl.) Kärnefelt & A. Thell,Consortium of Lichen Herbaria
Cladonia acuminata,Cladonia acuminata (Ach.) Norrl.,Consortium of Lichen Herbaria
Cladonia acuminata (Ach.) Norrl.,Cladonia acuminata (Ach.) Norrl.,Consortium of Lichen Herbaria
Cladonia alaskana,Cladonia alaskana A. Evans,Consortium of Lichen Herbaria
Cladonia albonigra,Cladonia albonigra Brodo & Ahti,Consortium of Lichen Herbaria
Cladonia amaurocraea,Cladonia amaurocraea (Flörke) Schaer.,Consortium of Lichen Herbaria
Cladonia amaurocraea (Fl?rke) Schaer.,Cladonia amaurocraea (Flörke) Schaer.,Consortium of Lichen Herbaria
Cladonia arbuscula s. lat.,Cladonia arbuscula (Wallr.) Flot.,Consortium of Lichen Herbaria
Cladina arbuscula,Cladonia arbuscula (Wallr.) Flot.,Consortium of Lichen Herbaria
Cladonia mitis,Cladonia arbuscula ssp. mitis (Sandst.) Ruoss,Consortium of Lichen Herbaria
Cladina mitis,Cladonia arbuscula ssp. mitis (Sandst.) Ruoss,Consortium of Lichen Herbaria
Cladonia arbuscula ssp. mitis,Cladonia arbuscula ssp. mitis (Sandst.) Ruoss,Consortium of Lichen Herbaria
Cladonia bacilliformis,Cladonia bacilliformis (Nyl.) Gluck,Consortium of Lichen Herbaria
Cladonia bellidiflora,Cladonia bellidiflora (Ach.) Schaer.,Consortium of Lichen Herbaria
Cladonia borealis,Cladonia borealis S. Stenroos,Consortium of Lichen Herbaria
Cladonia cariosa,Cladonia cariosa (Ach.) Spreng.,Consortium of Lichen Herbaria
Cladonia carneola,Cladonia carneola (Fr.) Fr.,Consortium of Lichen Herbaria
Cladonia cenotea,Cladonia cenotea (Ach.) Schaer.,Consortium of Lichen Herbaria
Cladonia chlorophaea,Cladonia chlorophaea (Flörke ex Sommerf.) Spreng.,Consortium of Lichen Herbaria
Cladonia coccifera s. lat.,Cladonia coccifera (L.) Willd.,Consortium of Lichen Herbaria
Cladonia coccifera s.l.,Cladonia coccifera (L.) Willd.,Consortium of Lichen Herbaria
Cladonia cornuta,Cladonia cornuta (L.) Hoffm.,Consortium of Lichen Herbaria
Cladonia cf. cornuta,Cladonia cornuta (L.) Hoffm.,Consortium of Lichen Herbaria
Cladonia crispata s. lat.,Cladonia crispata (Ach.) Flot.,Consortium of Lichen Herbaria
Cladonia cyanipes,Cladonia cyanipes (Sommerf.) Nyl.,Consortium of Lichen Herbaria
Cladonia decorticata,Cladonia decorticata (Flörke) Spreng.,Consortium of Lichen Herbaria
Cladonia deformis,Cladonia deformis (L.) Hoffm.,Consortium of Lichen Herbaria
Cladonia digitata,Cladonia digitata (L.) Hoffm.,Consortium of Lichen Herbaria
Cladonia ecmocyna,Cladonia ecmocyna Leight.,Consortium of Lichen Herbaria
Cladonia fimbriata,Cladonia fimbriata (L.) Fr.,Consortium of Lichen Herbaria
Cladonia furcata,Cladonia furcata (Huds.) Schrad.,Consortium of Lichen Herbaria
Cladonia gracilis s. lat.,Cladonia gracilis (L.) Willd.,Consortium of Lichen Herbaria
Cladonia gracilis,Cladonia gracilis (L.) Willd.,Consortium of Lichen Herbaria
Cladonia gracilis s.l.,Cladonia gracilis (L.) Willd.,Consortium of Lichen Herbaria
Cladonia gracilis ssp. vulnerata,Cladonia gracilis ssp. vulnerata Ahti,Consortium of Lichen Herbaria
Cladonia grayi,Cladonia grayi G. Merr. ex Sandst.,Consortium of Lichen Herbaria
Cladonia libifera,Cladonia libifera Savicz,Consortium of Lichen Herbaria
Cladonia macilenta v. bacillaris,Cladonia macilenta var. bacillaris (Genth) Schaer.,Consortium of Lichen Herbaria
Cladonia macilenta var. bacillaris,Cladonia macilenta var. bacillaris (Genth) Schaer.,Consortium of Lichen Herbaria
Cladonia macroceras,Cladonia macroceras (Delise) Hav.,Consortium of Lichen Herbaria
Cladonia macrophylla,Cladonia macrophylla (Schaer.) Stenh.,Consortium of Lichen Herbaria
Cladonia maxima,Cladonia maxima (Asahina) Ahti,Consortium of Lichen Herbaria
Cladonia metacorallifera,Cladonia metacorallifera Asahina,Consortium of Lichen Herbaria
Cladonia nipponica,Cladonia nipponica Asahina,Consortium of Lichen Herbaria
Cladonia phyllophora,Cladonia phyllophora Hoffm.,Consortium of Lichen Herbaria
Cladonia pleurota,Cladonia pleurota (Flörke) Schaer.,Consortium of Lichen Herbaria
Cladonia pocillum,Cladonia pocillum (Ach.) Grognot,Consortium of Lichen Herbaria
Cladonia pyxidata,Cladonia pyxidata (L.) Hoffm.,Consortium of Lichen Herbaria
Cladonia cf. pyxidata,Cladonia pyxidata (L.) Hoffm.,Consortium of Lichen Herbaria
Cladonia rangiferina,Cladonia rangiferina (L.) F.H. Wigg.,Consortium of Lichen Herbaria
Cladina rangiferina,Cladonia rangiferina (L.) F.H. Wigg.,Consortium of Lichen Herbaria
Cladonia scabriuscula,Cladonia scabriuscula (Delise) Nyl.,Consortium of Lichen Herbaria
Cladonia squamosa s. lat.,Cladonia squamosa (Scop.) Hoffm.,Consortium of Lichen Herbaria
Cladonia squamosa,Cladonia squamosa (Scop.) Hoffm.,Consortium of Lichen Herbaria
Cladonia stellaris,Cladonia stellaris (Opiz) Pouzar & Vězda,Consortium of Lichen Herbaria
Cetraria stellaris,Cladonia stellaris (Opiz) Pouzar & Vězda,Consortium of Lichen Herbaria
Cladonia stricta s. lat.,Cladonia stricta (Nyl.) Nyl.,Consortium of Lichen Herbaria
Cladonia stygia,Cladonia stygia (Fr.) Ruoss,Consortium of Lichen Herbaria
Cladina stygia,Cladonia stygia (Fr.) Ruoss,Consortium of Lichen Herbaria
Cladonia subfurcata,Cladonia subfurcata (Nyl.) Arnold,Consortium of Lichen Herbaria
Cladonia subulata,Cladonia subulata (L.) F.H. Wigg.,Consortium of Lichen Herbaria
Cladonia sulphurina,Cladonia sulphurina (Michx.) Fr.,Consortium of Lichen Herbaria
Cladonia symphycarpia,Cladonia symphycarpa (Flörke) Fr.,Consortium of Lichen Herbaria
Cladonia thomsonii,Cladonia thomsonii Ahti,Consortium of Lichen Herbaria
Cladonia trassii,Cladonia trassii Ahti,Consortium of Lichen Herbaria
Cladonia uncialis,Cladonia uncialis (L.) F.H. Wigg.,Consortium of Lichen Herbaria
Cladonia verticillata s. lat.,Cladonia verticillata (Hoffm.) Schaer.,Consortium of Lichen Herbaria
Collema species,Collema F.H. Wigg,Consortium of Lichen Herbaria
Dactylina arctica,Dactylina arctica (Richardson) Nyl.,Consortium of Lichen Herbaria
Dactylina beringica,Dactylina beringica C.D. Bird & J.W. Thomson,Consortium of Lichen Herbaria
Dactylina species,Dactylina Nyl.,Consortium of Lichen Herbaria
Dactylina sp.,Dactylina Nyl.,Consortium of Lichen Herbaria
Dactylina,Dactylina Nyl.,Consortium of Lichen Herbaria
Dactylina ramulosa,Dactylina ramulosa (Hook.) Tuck.,Consortium of Lichen Herbaria
Dermatocarpon arnoldianum,Dermatocarpon arnoldianum Degel.,Consortium of Lichen Herbaria
Diploschistes scruposus,Diploschistes scruposus (Schreb.) Norman,Consortium of Lichen Herbaria
Diplophyllum species,Diplotomma Flot.,Consortium of Lichen Herbaria
Collema bachmanianum,"Enchylium bachmanianum (Fink) Otálora, P.M. Jørg. & Wedin",Consortium of Lichen Herbaria
Collema tenax,Enchylium tenax (Sw.) Gray,Consortium of Lichen Herbaria
Epilichen scabrosus,Epilichen scabrosus (Ach.) Clem. ex Hafellner,Consortium of Lichen Herbaria
Evernia divaricata,Evernia divaricata (L.) Ach.,Consortium of Lichen Herbaria
Evernia perfragilis,Evernia perfragilis Llano,Consortium of Lichen Herbaria
Flavocetraria cucullata,Flavocetraria cucullata (Bellardi) Kärnefelt & A. Thell,Consortium of Lichen Herbaria
Flavocetraria species,Flavocetraria Kärnefelt & A. Thell,Consortium of Lichen Herbaria
Flavocetraria,Flavocetraria Kärnefelt & A. Thell,Consortium of Lichen Herbaria
Flavocetraria nivalis,Flavocetraria nivalis (L.) Kärnefelt & A. Thell,Consortium of Lichen Herbaria
Cetraria nivalis,Flavocetraria nivalis (L.) Kärnefelt & A. Thell,Consortium of Lichen Herbaria
Fuscopannaria praetermissa,Fuscopannaria praetermissa (Nyl.) P.M. Jørg.,Consortium of Lichen Herbaria
Gyalecta foveolaris,Gyalecta foveolaris (Ach.) Schaer.,Consortium of Lichen Herbaria
Hypogymnia species,Hypogymnia (Nyl.) Nyl.,Consortium of Lichen Herbaria
Hypogymnia austerodes,Hypogymnia austerodes (Nyl.) Räsänen,Consortium of Lichen Herbaria
Hypogymnia physodes,Hypogymnia physodes (L.) Nyl.,Consortium of Lichen Herbaria
Hypogymnia subobscura,Hypogymnia subobscura (Vain.) Poelt,Consortium of Lichen Herbaria
Hypogymnia vittata,Hypogymnia vittata (Ach.) Parrique,Consortium of Lichen Herbaria
Icmadophila ericetorum,Icmadophila ericetorum (L.) Zahlbr.,Consortium of Lichen Herbaria
Japewia tornoënsis,Japewia tornoënsis (Nyl.) Tønsberg,Consortium of Lichen Herbaria
Umbilicaria caroliniana,"Lasallia caroliniana (Tuck.) Davydov, Peršoh & Rambold",Consortium of Lichen Herbaria
Lasallia pensylvanica,Lasallia pensylvanica (Hoffm.) Llano,Consortium of Lichen Herbaria
Collema undulatum s. lat.,"Lathagrium undulatum (Laurer ex Flot.) Otálora, P.M. Jørg. & Wedin",Consortium of Lichen Herbaria
Lecanora species,Lecanora Ach.,Consortium of Lichen Herbaria
Lecanora sp.,Lecanora Ach.,Consortium of Lichen Herbaria
Lecanora circumborealis,Lecanora circumborealis Brodo & Vitik.,Consortium of Lichen Herbaria
Lecanora epibryon,Lecanora epibryon (Ach.) Ach.,Consortium of Lichen Herbaria
Lecanora geophila,Lecanora geophila (Th. Fr.) Poelt,Consortium of Lichen Herbaria
Lecanora luteovernalis,Lecanora luteovernalis Brodo,Consortium of Lichen Herbaria
Lecidea sp.,Lecidea Ach.,Consortium of Lichen Herbaria
Lecidea species,Lecidea Ach.,Consortium of Lichen Herbaria
Lecidea ramulosa,Lecidea ramulosa Th. Fr.,Consortium of Lichen Herbaria
Lecidella species,Lecidella Körb.,Consortium of Lichen Herbaria
Lecidella wulfenii,Lecidella wulfenii (Hepp) Körb.,Consortium of Lichen Herbaria
Lecidoma demissum,Lecidoma demissum (Rutstr.) Gotth. Schneid. & Hertel,Consortium of Lichen Herbaria
Lepraria species,Lepraria Ach.,Consortium of Lichen Herbaria
Lepraria neglecta,Lepraria neglecta (Nyl.) Erichsen,Consortium of Lichen Herbaria
Lepraria vouauxii,Lepraria vouauxii (Hue) R.C. Harris,Consortium of Lichen Herbaria
Leptogium saturninum,Leptogium saturninum (Dicks.) Nyl.,Consortium of Lichen Herbaria
Lichenomphalia hudsoniana,"Lichenomphalia hudsoniana (H.S. Jenn.) Redhead, Lutzoni, Moncalvo & Vilgalys",Consortium of Lichen Herbaria
Lobaria hallii,Lobaria hallii (Tuck.) Zahlbr.,Consortium of Lichen Herbaria
Lobaria linita,Lobaria linita (Ach.) Rabenh.,Consortium of Lichen Herbaria
Lobaria pseudopulmonaria,Lobaria pseudopulmonaria Gyeln.,Consortium of Lichen Herbaria
Lobaria species,Lobaria Schreb.,Consortium of Lichen Herbaria
Lobaria,Lobaria Schreb.,Consortium of Lichen Herbaria
Lopadium coralloideum,Lopadium coralloideum (Nyl.) Lynge,Consortium of Lichen Herbaria
Lopadium pezizoideum,Lopadium pezizoideum (Ach.) Körb.,Consortium of Lichen Herbaria
Masonhalea,Masonhalea Kärnefelt,Consortium of Lichen Herbaria
Masonhalea richardsonii,Masonhalea richardsonii (Hook.) Kärnefelt,Consortium of Lichen Herbaria
Megalaria jemtlandica,Megalaria jemtlandica (Th. Fr. & Almq.) Fryday,Consortium of Lichen Herbaria
Megaspora verrucosa,Megaspora verrucosa (Ach.) Hafellner & V. Wirth,Consortium of Lichen Herbaria
Melanelia agnata,Melanelia agnata (Nyl.) A. Thell,Consortium of Lichen Herbaria
Melanelia hepatizon,Melanelia hepatizon (Ach.) A. Thell,Consortium of Lichen Herbaria
Melanelia stygia,Melanelia stygia (L.) Essl.,Consortium of Lichen Herbaria
Micarea assimilata,Micarea assimilata (Nyl.) Coppins,Consortium of Lichen Herbaria
Micarea species,Micarea Fr.,Consortium of Lichen Herbaria
Micarea incrassata,Micarea incrassata Hedl.,Consortium of Lichen Herbaria
Mycoblastus sanguinarius,Mycoblastus sanguinarius (L.) Norman,Consortium of Lichen Herbaria
Nephroma species,Nephroma Ach.,Consortium of Lichen Herbaria
Nephroma sp.,Nephroma Ach.,Consortium of Lichen Herbaria
Nephroma,Nephroma Ach.,Consortium of Lichen Herbaria
Nephroma arcticum,Nephroma arcticum (L.) Torss.,Consortium of Lichen Herbaria
Nephroma bellum,Nephroma bellum (Spreng.) Tuck.,Consortium of Lichen Herbaria
Nephroma expallidum,Nephroma expallidum (Nyl.) Nyl.,Consortium of Lichen Herbaria
Nephroma parile,Nephroma parile (Ach.) Ach.,Consortium of Lichen Herbaria
Nephroma resupinatum,Nephroma resupinatum (L.) Ach.,Consortium of Lichen Herbaria
Ochrolechia species,Ochrolechia A. Massal.,Consortium of Lichen Herbaria
Ochrolechia,Ochrolechia A. Massal.,Consortium of Lichen Herbaria
Ochrolechia androgyna,Ochrolechia androgyna (Hoffm.) Arnold,Consortium of Lichen Herbaria
Ochrolechia bryophaga,Ochrolechia bryophaga (Erichsen) K. Schmitz & Lumbsch,Consortium of Lichen Herbaria
Ochrolechia frigida,Ochrolechia frigida (Sw.) Lynge,Consortium of Lichen Herbaria
Ochrolechia inaequatula,Ochrolechia inaequatula (Nyl.) Zahlbr.,Consortium of Lichen Herbaria
Ochrolechia upsaliensis,Ochrolechia upsaliensis (L.) A. Massal.,Consortium of Lichen Herbaria
Ophioparma lapponica,Ophioparma lapponica (Räsänen) Hafellner & R.W. Rogers,Consortium of Lichen Herbaria
Parmelia species,Parmelia Ach.,Consortium of Lichen Herbaria
Parmelia,Parmelia Ach.,Consortium of Lichen Herbaria
Parmelia fraudans,Parmelia fraudans (Nyl.) Nyl.,Consortium of Lichen Herbaria
Parmelia omphalodes s. lat.,Parmelia omphalodes (L.) Ach.,Consortium of Lichen Herbaria
Parmelia sulcata,Parmelia sulcata Taylor,Consortium of Lichen Herbaria
Parmeliopsis ambigua,Parmeliopsis ambigua (Wulfen) Nyl.,Consortium of Lichen Herbaria
Parmeliopsis hyperopta,Parmeliopsis hyperopta (Ach.) Arnold,Consortium of Lichen Herbaria
Peltigera aphthosa,Peltigera aphthosa (L.) Willd.,Consortium of Lichen Herbaria
Peltigera britannica,Peltigera britannica (Gyeln.) Holt.-Hartw. & Tonsb.,Consortium of Lichen Herbaria
Peltigera canina,Peltigera canina (L.) Willd.,Consortium of Lichen Herbaria
Peltigera collina,Peltigera collina (Ach.) Schrad.,Consortium of Lichen Herbaria
Peltigera didactyla s.lat.,Peltigera didactyla (With.) J.R. Laundon,Consortium of Lichen Herbaria
Peltigera elisabethae,Peltigera elisabethae Gyeln.,Consortium of Lichen Herbaria
Peltigera extenuata,Peltigera extenuata (Nyl. ex Vain.) Lojka,Consortium of Lichen Herbaria
Peltigera horizontalis,Peltigera horizontalis (Huds.) Baumg.,Consortium of Lichen Herbaria
Peltigera lepidophora,Peltigera lepidophora (Vain.) Bitter,Consortium of Lichen Herbaria
Peltigera leucophlebia,Peltigera leucophlebia (Nyl.) Gyeln.,Consortium of Lichen Herbaria
Peltigera malacea,Peltigera malacea (Ach.) Funck,Consortium of Lichen Herbaria
Peltigera membranacea,Peltigera membranacea (Ach.) Nyl.,Consortium of Lichen Herbaria
Peltigera neckeri,Peltigera neckeri Hepp ex Müll. Arg.,Consortium of Lichen Herbaria
Peltigera neopolydactyla,Peltigera neopolydactyla (Gyeln.) Gyeln.,Consortium of Lichen Herbaria
Peltigera polydactyla,Peltigera neopolydactyla (Gyeln.) Gyeln.,Consortium of Lichen Herbaria
Peltigera polydactylon,Peltigera polydactylon (Neck.) Hoffm.,Consortium of Lichen Herbaria
Peltigera praetextata,Peltigera praetextata (Flörke ex Sommerf.) Zopf,Consortium of Lichen Herbaria
Peltigera rufescens,Peltigera rufescens (Weiss) Humb.,Consortium of Lichen Herbaria
Peltigera scabrosa,Peltigera scabrosa Th. Fr.,Consortium of Lichen Herbaria
Peltigera venosa,Peltigera venosa (L.) Hoffm.,Consortium of Lichen Herbaria
Peltigera species,Peltigera Willd.,Consortium of Lichen Herbaria
Peltigera sp.,Peltigera Willd.,Consortium of Lichen Herbaria
Peltigera,Peltigera Willd.,Consortium of Lichen Herbaria
Pertusaria bryontha,Pertusaria bryontha (Ach.) Nyl.,Consortium of Lichen Herbaria
Pertusaria coriacea,Pertusaria coriacea (Th. Fr.) Th. Fr.,Consortium of Lichen Herbaria
Pertusaria coriacea obducens,Pertusaria coriacea (Th. Fr.) Th. Fr.,Consortium of Lichen Herbaria
Pertusaria sp.,Pertusaria DC.,Consortium of Lichen Herbaria
Pertusaria species,Pertusaria DC.,Consortium of Lichen Herbaria
Pertusaria geminipara,Pertusaria geminipara (Th. Fr.) C. Knight ex Brodo,Consortium of Lichen Herbaria
Pertusaria glomerata,Pertusaria glomerata (Ach.) Schaer.,Consortium of Lichen Herbaria
Pertusaria octomela,Pertusaria octomela (Norman) Erichsen,Consortium of Lichen Herbaria
Pertusaria oculata,Pertusaria oculata (Dicks.) Th. Fr.,Consortium of Lichen Herbaria
Pertusaria subobducens,Pertusaria subobducens Nyl.,Consortium of Lichen Herbaria
Phaeophyscia constipata,Phaeophyscia constipata (Norrl. & Nyl.) Moberg,Consortium of Lichen Herbaria
Phaeorrhiza nimbosa,Phaeorrhiza nimbosa (Fr.) H. Mayrh. & Poelt,Consortium of Lichen Herbaria
Physcia species,Physcia (Schreb.) Michx.,Consortium of Lichen Herbaria
Physcia aipolia,Physcia aipolia (Ehrh. ex Humb.) Furnr.,Consortium of Lichen Herbaria
Physconia muscigena,Physconia muscigena (Ach.) Poelt,Consortium of Lichen Herbaria
Placidiopsis pseudocinerea,Placidiopsis pseudocinerea Breuss,Consortium of Lichen Herbaria
Placidium lachneum,Placidium lachneum (Ach.) B. de Lesd.,Consortium of Lichen Herbaria
Placopsis gelida,Placopsis gelida (L.) Lindsay,Consortium of Lichen Herbaria
Placynthiella uliginosa,Placynthiella uliginosa (Schrad.) Coppins & P. James,Consortium of Lichen Herbaria
Placynthium nigrum,Placynthium nigrum (Huds.) A. Gray,Consortium of Lichen Herbaria
Polyblastia sendtneri,Polyblastia sendtneri Kremp.,Consortium of Lichen Herbaria
Polychidium muscicola,Polychidium muscicola (Sw.) A. Gray,Consortium of Lichen Herbaria
